{"$schema":"https://json-schema.org/draft/2020-12/schema","properties":{"artifact":{"type":"object"},"authoritative":{"type":"boolean"},"derivation_ref":{"type":"string"},"expected":{"type":"object"},"fixture_id":{"type":"string"},"group":{"type":"string"},"modality":{"enum":["text","json","image"]},"phenomenon":{"type":"string"},"profile_ref":{"type":"object"},"purpose":{"type":"string"},"release_ref":{"type":"string"},"validation_record":{"type":"object"}},"required":["fixture_id","group","modality","validation_record","artifact","expected","authoritative"],"title":"Corpus fixture (v1.1)","type":"object"}
