{"artifact":{"descriptor":{"is_stream":false,"modality":"text"},"parts":[{"text":"acme ow​ns system b"}]},"authoritative":true,"derivation_ref":"derivations/SEC07.json","expected":{"evaluation_summary":{"evaluated_assertive":0,"evaluation_limitations":1,"positive_violations":0,"total_assertive":1,"unevaluated_assertive":1,"x-tap-e7-base-evaluation-summary":{"companion_method_counts":{"no_match":0,"unresolved":1},"correspondence_method_counts":{"exact":0,"explicit":0,"lexical":0,"structured":0},"correspondence_units_total":1}},"findings":[{"category":"CORRESPONDENCE_UNRESOLVED","finding_index":0,"polarity":"EVALUATION_LIMITATION"}],"outcome":"INDETERMINATE","projection_pi":{"evaluation_summary":{"evaluated_assertive":0,"evaluation_limitations":1,"positive_violations":0,"total_assertive":1,"unevaluated_assertive":1},"findings":[{"category":"CORRESPONDENCE_UNRESOLVED","polarity":"EVALUATION_LIMITATION"}],"outcome":"INDETERMINATE"},"projection_pi_sha256":"sha-256:cb144001a546d2481c4701fa012d2ff29e32dcf929efaaf29f83fffd301fd24c"},"fixture_id":"SEC07","group":"SEC","modality":"text","phenomenon":"security","profile_ref":{"profile_id":"tap-e7-base","profile_version":"1.0"},"purpose":"zero-width insertion","release_ref":"tap-e7-base-companion/1.1.0","validation_record":{"entries":[{"confidence":"HIGH","entry_id":"V1","object":"system b","predicate":"owns","scope":{},"status":"SUPPORTED","subject":"acme"}]}}
