{"artifact":{"descriptor":{"is_stream":false,"modality":"text"},"parts":[{"text":"   "}]},"authoritative":true,"derivation_ref":"derivations/ZR02.json","expected":{"evaluation_summary":{"evaluated_assertive":0,"evaluation_limitations":0,"positive_violations":0,"total_assertive":0,"unevaluated_assertive":0,"x-tap-e7-base-evaluation-summary":{"companion_method_counts":{"no_match":0,"unresolved":0},"correspondence_method_counts":{"exact":0,"explicit":0,"lexical":0,"structured":0},"correspondence_units_total":0}},"findings":[],"outcome":"ASSURED","projection_pi":{"evaluation_summary":{"evaluated_assertive":0,"evaluation_limitations":0,"positive_violations":0,"total_assertive":0,"unevaluated_assertive":0},"findings":[],"outcome":"ASSURED"},"projection_pi_sha256":"sha-256:7bfc41c9bd0b09a53678db2574a59b5de6b5842b93bee8faae773a801ecd3a2e"},"fixture_id":"ZR02","group":"ZR","modality":"text","phenomenon":"zero_assertion","profile_ref":{"profile_id":"tap-e7-base","profile_version":"1.0"},"purpose":"whitespace only","release_ref":"tap-e7-base-companion/1.1.0","validation_record":{"entries":[{"confidence":"HIGH","entry_id":"V1","object":"system b","predicate":"owns","scope":{},"status":"SUPPORTED","subject":"acme"}]}}
