{"artifact":{"descriptor":{"is_stream":false,"modality":"json"},"parts":[{"input":{"hex":"efbbbf7b226b223a317d","kind":"raw_bytes_hex"}}]},"authoritative":true,"derivation_ref":"derivations/JS04.json","expected":{"evaluation_summary":{"evaluated_assertive":0,"evaluation_limitations":1,"positive_violations":0,"total_assertive":0,"unevaluated_assertive":0,"x-tap-e7-base-evaluation-summary":{"companion_method_counts":{"no_match":0,"unresolved":0},"correspondence_method_counts":{"exact":0,"explicit":0,"lexical":0,"structured":0},"correspondence_units_total":0}},"findings":[{"category":"INPUT_INTEGRITY_FAILURE","finding_index":0,"polarity":"EVALUATION_LIMITATION"}],"outcome":"INDETERMINATE","projection_pi":{"evaluation_summary":{"evaluated_assertive":0,"evaluation_limitations":1,"positive_violations":0,"total_assertive":0,"unevaluated_assertive":0},"findings":[{"category":"INPUT_INTEGRITY_FAILURE","polarity":"EVALUATION_LIMITATION"}],"outcome":"INDETERMINATE"},"projection_pi_sha256":"sha-256:1cd34ac9a779608607d5d7d582ac4c89802e6b1beda595aa241e96fbc80ff586"},"fixture_id":"JS04","group":"JS","modality":"json","phenomenon":"strict_json","profile_ref":{"profile_id":"tap-e7-base","profile_version":"1.0"},"purpose":"UTF-8 BOM prefix","release_ref":"tap-e7-base-companion/1.1.0","validation_record":{"entries":[]}}
