{"artifact":{"alt_representation":{"text":"acme owns system b"},"descriptor":{"is_stream":false,"modality":"text"},"parts":[{"text":"acme  owns   system b"}]},"authoritative":true,"derivation_ref":"derivations/DT02.json","expected":{"evaluation_summary":{"evaluated_assertive":1,"evaluation_limitations":0,"positive_violations":0,"total_assertive":1,"unevaluated_assertive":0,"x-tap-e7-base-evaluation-summary":{"companion_method_counts":{"no_match":0,"unresolved":0},"correspondence_method_counts":{"exact":1,"explicit":0,"lexical":0,"structured":0},"correspondence_units_total":1}},"findings":[],"outcome":"ASSURED","projection_pi":{"evaluation_summary":{"evaluated_assertive":1,"evaluation_limitations":0,"positive_violations":0,"total_assertive":1,"unevaluated_assertive":0},"findings":[],"outcome":"ASSURED"},"projection_pi_sha256":"sha-256:fad8f5c73b714ed573aa95752449be4ea94c88398e26cb4bbb413b951d8cf9e7"},"fixture_id":"DT02","group":"DT","modality":"text","phenomenon":"determinism","profile_ref":{"profile_id":"tap-e7-base","profile_version":"1.0"},"purpose":"markdown insignificant spacing","release_ref":"tap-e7-base-companion/1.1.0","validation_record":{"entries":[{"confidence":"HIGH","entry_id":"V1","object":"system b","predicate":"owns","scope":{},"status":"SUPPORTED","subject":"acme"}]}}
