{"artifact":{"descriptor":{"is_stream":false,"modality":"json"},"parts":[{"input":{"kind":"recipe","recipe":{"length":1048577,"type":"string_value"}}}]},"authoritative":true,"derivation_ref":"derivations/JS20.json","expected":{"evaluation_summary":{"evaluated_assertive":0,"evaluation_limitations":1,"positive_violations":0,"total_assertive":0,"unevaluated_assertive":0,"x-tap-e7-base-evaluation-summary":{"companion_method_counts":{"no_match":0,"unresolved":0},"correspondence_method_counts":{"exact":0,"explicit":0,"lexical":0,"structured":0},"correspondence_units_total":0}},"findings":[{"category":"PROCESSING_FAILURE","finding_index":0,"polarity":"EVALUATION_LIMITATION"}],"outcome":"INDETERMINATE","projection_pi":{"evaluation_summary":{"evaluated_assertive":0,"evaluation_limitations":1,"positive_violations":0,"total_assertive":0,"unevaluated_assertive":0},"findings":[{"category":"PROCESSING_FAILURE","polarity":"EVALUATION_LIMITATION"}],"outcome":"INDETERMINATE"},"projection_pi_sha256":"sha-256:f718efcd0fd3ec41f1c8a0dec5766805f5ea0c0e0c67b80915fb395b8e73498d"},"fixture_id":"JS20","group":"JS","modality":"json","phenomenon":"strict_json","profile_ref":{"profile_id":"tap-e7-base","profile_version":"1.0"},"purpose":"string length 1048577 exceeds limit","release_ref":"tap-e7-base-companion/1.1.0","validation_record":{"entries":[]}}
