{"artifact":{"descriptor":{"is_stream":false,"modality":"text"},"parts":[{"text":"system node server network module cluster record vendor report auditor device region sector domain"}]},"authoritative":true,"derivation_ref":"derivations/LX01.json","expected":{"evaluation_summary":{"evaluated_assertive":0,"evaluation_limitations":1,"positive_violations":0,"total_assertive":1,"unevaluated_assertive":1,"x-tap-e7-base-evaluation-summary":{"companion_method_counts":{"no_match":0,"unresolved":1},"correspondence_method_counts":{"exact":0,"explicit":0,"lexical":0,"structured":0},"correspondence_units_total":1}},"findings":[{"category":"CORRESPONDENCE_UNRESOLVED","finding_index":0,"polarity":"EVALUATION_LIMITATION"}],"outcome":"INDETERMINATE","projection_pi":{"evaluation_summary":{"evaluated_assertive":0,"evaluation_limitations":1,"positive_violations":0,"total_assertive":1,"unevaluated_assertive":1},"findings":[{"category":"CORRESPONDENCE_UNRESOLVED","polarity":"EVALUATION_LIMITATION"}],"outcome":"INDETERMINATE"},"projection_pi_sha256":"sha-256:cb144001a546d2481c4701fa012d2ff29e32dcf929efaaf29f83fffd301fd24c"},"fixture_id":"LX01","group":"LX","modality":"text","phenomenon":"lexical_jaccard","profile_ref":{"profile_id":"tap-e7-base","profile_version":"1.0"},"purpose":"jaccard exactly 0.35 -> unresolved","release_ref":"tap-e7-base-companion/1.1.0","validation_record":{"entries":[{"confidence":"HIGH","entry_id":"V1","object":"server network module cluster record segment channel gateway archive ledger monitor","predicate":"node","scope":{},"status":"SUPPORTED","subject":"system"}]}}
